{
  "schemaVersion": 1,
  "decision": "ADR-0028",
  "phase": "C0",
  "owner": "architecture",
  "package": {
    "name": "@get-modular/ownership",
    "root": "packages/ownership",
    "materialized": false,
    "runtimeDependencies": []
  },
  "activation": {
    "implementation": "pending",
    "cmsGuidance": "pending",
    "arAdoption": "pending",
    "sdkAdmission": "pending"
  },
  "contract": {
    "path": "architecture/contracts/ownership/public-contract.d.ts",
    "digest": "sha256:b69c3dbfe5f81d3e344cf48ebed07efb6eaf01b93756891a2cddbf97cddca88d",
    "decisionPath": "docs/decisions/0028-authorize-the-optional-ownership-contract-checkpoint.md",
    "decisionDigest": "sha256:6edd5c84db53f63525f03df6da21f6b4da284b770cbc727f7a4ed8e170551973"
  },
  "evidence": {
    "base": "ac49bb3374946330ec820591f8195a22d2c90900",
    "packages": {
      "core": "0.2.0",
      "assembly": "0.2.0"
    },
    "lockDigest": "sha256:126fb4b67fdc6ed0bf4c927e5f27cc3e698699cab2d3b9d1f984b80c60884276",
    "cms": {
      "path": "docs/architecture/common-assembly.md",
      "commit": "ac49bb3374946330ec820591f8195a22d2c90900",
      "digest": "sha256:d5bb71e5a700014f9f0a09b17d1f33d24b30b66c49b273c9fb65584672c51e4f"
    },
    "ar": {
      "revision": "be96f01ea54ec7d2ec0156774e3dfb75fac46803",
      "activeStandard": {
        "repository": "agent-teams-ai/get-modular",
        "path": "docs/architecture/common-assembly.md",
        "anchor": "consumer-module-standard",
        "decision": "ADR-0026",
        "commit": "669a750d8db451e04f075cdeb36576c6606fba6e",
        "sha256": "e6cd8d26b4317bf5f94ddd22f6e36bf25e90548f72265d94808eaf20b947e553",
        "evidencePath": "architecture/get-modular/evidence/consumer-module-standard.md"
      },
      "scopeEligibility": "pending",
      "candidateSites": [
        {
          "path": "packages/apps/embedded-runtime/src/composition/default-agent-runtime-host.ts",
          "digest": "sha256:999a426602c19830fca5e230c58a467ccda717e157f05db61f4b3373e5a1d951"
        },
        {
          "path": "packages/apps/embedded-runtime/src/features/ordinary-session-runtime/composition/ordinary-agent-runtime-host.ts",
          "digest": "sha256:0cb13268e0bafc2448b709639d0eeb6e091759aa5e4885b15383c859b9d8fec8"
        }
      ],
      "profile": {
        "path": "architecture/get-modular/consumer-profile.json",
        "digest": "sha256:2373779b480bd455978189e2ed3cee726346827d626bbc4545401e3f393c01e6"
      }
    },
    "plan": {
      "digest": "sha256:e025978dcf3cfac12b7795fa3aafc96f06838620e124df4cc091ebee45352864"
    },
    "efBase": "eadd117f98e8b93318426ab9d77d5890aab2e15e"
  },
  "contractRevision": "gm-ownership-c0/1",
  "consumers": [
    "GM K1",
    "GM G1",
    "AR C0",
    "AR A1"
  ]
}
